{
  "$schema": "https://json-schema.org/draft/2020-12/schema",
  "title": "Imperatle empire",
  "description": "One empire of the game. The file name must be <slug>.json.",
  "type": "object",
  "additionalProperties": false,
  "required": [
    "slug",
    "name",
    "peak",
    "start",
    "end",
    "area",
    "mapAccuracy",
    "continents",
    "primaryContinent",
    "capital",
    "language",
    "religion",
    "curiosities"
  ],
  "properties": {
    "$schema": { "type": "string" },
    "slug": {
      "description": "Stable id: lowercase words separated by hyphens, e.g. \"mongol-empire\". Never change it after launch (players' history points to it).",
      "type": "string",
      "pattern": "^[a-z0-9]+(-[a-z0-9]+)*$"
    },
    "name": { "$ref": "#/$defs/text", "description": "Name shown in the guess list and in the answer." },
    "peak": { "$ref": "#/$defs/year", "description": "Year of the greatest territorial extent, the moment the map shows. The era clue is computed from it." },
    "start": { "$ref": "#/$defs/year", "description": "When the empire began." },
    "end": {
      "description": "When the empire ended, or null if it still exists (its duration then runs to the current year).",
      "oneOf": [{ "$ref": "#/$defs/year" }, { "type": "null" }]
    },
    "durationNotes": { "$ref": "#/$defs/text", "description": "Optional caveat shown next to the duration, e.g. which phase of a longer state the dates cover." },
    "religionNotes": { "$ref": "#/$defs/text", "description": "Optional caveat shown next to the religion, e.g. that most subjects followed other faiths." },
    "area": {
      "description": "Largest area ever controlled (same moment as peak).",
      "type": "object",
      "additionalProperties": false,
      "required": ["km2", "precision"],
      "properties": {
        "km2": { "type": "integer", "minimum": 1 },
        "precision": { "enum": ["Exact", "Approximate"] }
      }
    },
    "mapAccuracy": {
      "description": "How well historians know the borders on the map: Precise (High), Approximate (Medium), Speculative (Low).",
      "enum": ["Precise", "Approximate", "Speculative"]
    },
    "continents": {
      "description": "Every continent where the empire held territory at its peak.",
      "type": "array",
      "minItems": 1,
      "uniqueItems": true,
      "items": { "$ref": "#/$defs/continent" }
    },
    "primaryContinent": { "$ref": "#/$defs/continent", "description": "Where most of the territory was. Must be one of continents." },
    "capital": { "$ref": "#/$defs/text" },
    "language": { "$ref": "#/$defs/text", "description": "Main language of the government and the elite." },
    "religion": { "$ref": "#/$defs/text", "description": "Official religion, or that of the ruling elite." },
    "curiosities": {
      "description": "Exactly 3, from the least obvious to the most obvious. They're revealed in this order.",
      "type": "array",
      "minItems": 3,
      "maxItems": 3,
      "items": { "$ref": "#/$defs/text" }
    },
    "wikipedia": {
      "description": "Wikipedia article links, shown once the round is over (never before, they'd give the answer away).",
      "type": "object",
      "additionalProperties": false,
      "required": ["en", "pt"],
      "properties": {
        "en": { "type": "string", "pattern": "^https://en\\.wikipedia\\.org/wiki/.+" },
        "pt": { "type": "string", "pattern": "^https://pt\\.wikipedia\\.org/wiki/.+" }
      }
    },
    "map": {
      "description": "Optional while the map isn't ready (the game shows a placeholder). The shape is built by apps/web/scripts/maps/build-shapes.mjs into Content/shapes/<slug>.json.",
      "type": "object",
      "additionalProperties": false,
      "required": ["parts"],
      "properties": {
        "parts": {
          "description": "Merged into the shape: Cliopatria polities, each at a year its record covers (usually the peak year), plus today's territories for land the dataset misses and areas drawn by hand in the empire generator (added, or cut out of everything else). At least one polity.",
          "type": "array",
          "minItems": 1,
          "items": {
            "oneOf": [
              {
                "type": "object",
                "additionalProperties": false,
                "required": ["polity", "year"],
                "properties": {
                  "polity": { "description": "Cliopatria \"Name\", exactly, e.g. \"Mongol Empire\" or \"(British Empire)\".", "type": "string", "minLength": 1 },
                  "year": { "description": "Negative = BCE. There is no year 0.", "type": "integer", "not": { "const": 0 } }
                }
              },
              {
                "type": "object",
                "additionalProperties": false,
                "required": ["country"],
                "properties": {
                  "country": { "description": "A territory as it is today, for land Cliopatria misses: Natural Earth's 3-letter code (ADM0_A3), e.g. \"PYF\" for French Polynesia.", "type": "string", "pattern": "^[A-Z]{3}$" },
                  "box": {
                    "description": "Optional: only the part of the territory inside [west, south, east, north], in degrees, e.g. [-180, 60, -165, 70.5] for the tip of Chukotka.",
                    "type": "array",
                    "items": { "type": "number" },
                    "minItems": 4,
                    "maxItems": 4
                  }
                }
              },
              {
                "type": "object",
                "additionalProperties": false,
                "required": ["draw", "ring"],
                "properties": {
                  "draw": { "description": "\"add\" merges the area into the shape; \"remove\" cuts it out of everything else.", "enum": ["add", "remove"] },
                  "ring": {
                    "description": "The area's outline, traced in the empire generator: [longitude, latitude] points in degrees. Longitudes run on past ±180 for a ring drawn across the antimeridian.",
                    "type": "array",
                    "minItems": 3,
                    "items": { "type": "array", "items": { "type": "number" }, "minItems": 2, "maxItems": 2 }
                  }
                }
              }
            ]
          }
        }
      }
    }
  },
  "$defs": {
    "text": {
      "type": "object",
      "additionalProperties": false,
      "required": ["en", "pt"],
      "properties": {
        "en": { "type": "string", "minLength": 1 },
        "pt": { "type": "string", "minLength": 1 }
      }
    },
    "year": {
      "type": "object",
      "additionalProperties": false,
      "required": ["year", "precision"],
      "properties": {
        "year": {
          "description": "Negative = BCE, as historians write it: -27 is 27 BCE. There is no year 0.",
          "type": "integer",
          "not": { "const": 0 }
        },
        "precision": {
          "description": "Exact, Approximate (circa) or Century (only the century is known).",
          "enum": ["Exact", "Approximate", "Century"]
        }
      }
    },
    "continent": { "enum": ["Africa", "Asia", "Europe", "NorthAmerica", "SouthAmerica", "Oceania"] }
  }
}
