{
  "$schema": "../empire.schema.json",
  "slug": "mongol-empire",
  "name": {
    "en": "Mongol Empire",
    "pt": "Império Mongol"
  },
  "peak": {
    "year": 1279,
    "precision": "Exact"
  },
  "start": {
    "year": 1206,
    "precision": "Exact"
  },
  "end": {
    "year": 1368,
    "precision": "Approximate"
  },
  "durationNotes": {
    "en": "There is no single end date. In 1260 the empire split into four parts; in 1294 the leader who still held them loosely together died; and in 1368 the main one of the four fell, which is the date used here. 1260 and 1294 are also accepted.",
    "pt": "Não há uma data única para o fim. Em 1260 o império se dividiu em quatro partes; em 1294 morreu o líder que ainda mantinha certa unidade entre elas; e em 1368 caiu a principal das quatro, que é a data usada aqui. 1260 e 1294 também são aceitos."
  },
  "area": {
    "km2": 24000000,
    "precision": "Approximate"
  },
  "mapAccuracy": "Approximate",
  "continents": [
    "Asia",
    "Europe"
  ],
  "primaryContinent": "Asia",
  "capital": {
    "en": "Karakorum (later Khanbaliq)",
    "pt": "Karakorum (depois Khanbaliq)"
  },
  "language": {
    "en": "Mongolian",
    "pt": "Mongol"
  },
  "religion": {
    "en": "Tengrism (tolerant of other religions)",
    "pt": "Tengrismo (com tolerância a outras religiões)"
  },
  "curiosities": [
    {
      "en": "It was founded by a leader who united nomadic tribes under one banner.",
      "pt": "Foi fundado por um líder que uniu tribos nômades sob uma só bandeira."
    },
    {
      "en": "Its warriors fought as mounted archers, and each one brought several horses to swap during marches.",
      "pt": "Seus guerreiros lutavam como arqueiros a cavalo, e cada um levava vários cavalos para trocar durante as marchas."
    },
    {
      "en": "It became the largest contiguous land empire in history.",
      "pt": "Tornou-se o maior império contíguo da história."
    }
  ],
  "wikipedia": {
    "en": "https://en.wikipedia.org/wiki/Mongol_Empire",
    "pt": "https://pt.wikipedia.org/wiki/Império_Mongol"
  },
  "map": {
    "parts": [
      { "polity": "Mongol Empire", "year": 1279 }
    ]
  }
}
